{
  "version_estado": "1.0",
  "trabajo_id": "trb_01J9ZQ4K8M2V7X",
  "referencia": {
    "ficha_id": 140,
    "plantilla_codigo": "FTE-EBR-V03"
  },
  "estado": "esperando_datos",
  "cancelando": false,
  "porcentaje": 0,
  "etapa": "esperando_datos",
  "mensaje": "La IA necesita 2 datos para continuar",
  "seccion_actual": null,
  "totales": {
    "secciones_totales": 6,
    "secciones_completadas": 0,
    "campos_totales": 66,
    "campos_completados": 0,
    "tablas_totales": 118,
    "tablas_completadas": 0
  },
  "secciones": [
    {
      "id": "d3a96d61-750f-4b37-ae42-4ad57446138a",
      "numero": "01",
      "nombre": "ASPECTOS GENERALES",
      "estado": "en_curso",
      "porcentaje": 0,
      "campos_totales": 55,
      "campos_completados": 0,
      "tablas_totales": 75,
      "tablas_completadas": 0
    },
    {
      "id": "941fabc3-5267-414b-8793-101fbce82d5e",
      "numero": "02",
      "nombre": "ANEXO 01: COSTOS UNITARIOS REFERENCIALES DE ACTIVOS ESTRATEGICOS",
      "estado": "pendiente",
      "porcentaje": 0,
      "campos_totales": 5,
      "campos_completados": 0,
      "tablas_totales": 1,
      "tablas_completadas": 0
    },
    {
      "id": "c40eb510-0f57-4353-b41d-640d2da36af6",
      "numero": "03",
      "nombre": "ANEXO 02: PRESUPUESTO DE INFRAESTRUCTURA",
      "estado": "pendiente",
      "porcentaje": 0,
      "campos_totales": 1,
      "campos_completados": 0,
      "tablas_totales": 25,
      "tablas_completadas": 0
    },
    {
      "id": "594f40b1-6b96-4614-97f8-1625a52a7dad",
      "numero": "04",
      "nombre": "ANEXO 03: PRESUPUESTO DE MOBILIARIO Y EQUIPO",
      "estado": "pendiente",
      "porcentaje": 0,
      "campos_totales": 1,
      "campos_completados": 0,
      "tablas_totales": 4,
      "tablas_completadas": 0
    },
    {
      "id": "ee6f1df7-c901-4f32-8253-873224a026ae",
      "numero": "05",
      "nombre": "ANEXO 04: ACCIONES CONSOLIDADAS",
      "estado": "pendiente",
      "porcentaje": 0,
      "campos_totales": 0,
      "campos_completados": 0,
      "tablas_totales": 5,
      "tablas_completadas": 0
    },
    {
      "id": "6018b66a-28c7-46df-8a44-f85ac7125b5b",
      "numero": "06",
      "nombre": "ANEXO 05: EVALUACIÓN ECONÓMICA - ALTERNATIVA N°1",
      "estado": "pendiente",
      "porcentaje": 0,
      "campos_totales": 4,
      "campos_completados": 0,
      "tablas_totales": 8,
      "tablas_completadas": 0
    }
  ],
  "preguntas": [
    {
      "id": "q1",
      "pregunta": "¿Cuál es la naturaleza de intervención del proyecto?",
      "motivo": "Los documentos describen las obras pero no dicen si es una creación, una ampliación o un mejoramiento.",
      "campo_ids": ["1.01.03"],
      "opciones": ["Creación", "Ampliación", "Mejoramiento", "Recuperación"],
      "seccion_id": "d3a96d61-750f-4b37-ae42-4ad57446138a"
    },
    {
      "id": "q2",
      "pregunta": "¿Qué unidad orgánica será la Unidad Formuladora?",
      "motivo": "No consta en ninguno de los documentos cargados.",
      "campo_ids": ["1.02.01"],
      "seccion_id": "d3a96d61-750f-4b37-ae42-4ad57446138a"
    }
  ],
  "pausas": 1,
  "creado_en": "2026-10-17T22:15:30Z",
  "iniciado_en": "2026-10-17T22:15:41Z",
  "actualizado_en": "2026-10-17T22:16:12Z",
  "terminado_en": null,
  "segundos_restantes_estimados": null,
  "resultado": null,
  "error": null,
  "advertencias": []
}
